{
  "schema": "lucky-skills/registry@1",
  "tag": "v2.10.2",
  "commit": "398129a62d2b1385da0fcb13d9eeae820ad04ace",
  "raw_base": "${SKILLS_REGISTRY_URL}",
  "note": "Verificacion de integridad por codigo externo: sha256 -c por archivo, sobre bytes LF, contra este registry traido raw@REF del install. El cliente NUNCA computa NI transcribe el hash. La firma minisign fue RETIRADA (ADR 0009, dueño unico del repo; vuelve si el trade-off cambia): el ancla es el PIN que fija el install en state.env — v1 pinea por TAG; el campo commit es informativo (la forja corre pre-commit; pin-por-commit real = v2). Solo se cargan como dato las skills loadable_as_data=true; requires_runtime/requires_tools -> fast-path de install.",
  "skills": [
    {
      "name": "arquitectura",
      "kind": "runtime",
      "loadable_as_data": false,
      "requires_runtime": [],
      "requires_tools": [
        "Bash"
      ],
      "path": "plugins/lucky/skills/arquitectura/SKILL.md",
      "url": "${SKILLS_REGISTRY_URL}/v2.10.2/plugins/lucky/skills/arquitectura/SKILL.md",
      "sha256": "c443401e3664337d251c8683b38b2ef40a96141ba4550501922169f2183d7b3d"
    },
    {
      "name": "bitacora",
      "kind": "runtime",
      "loadable_as_data": false,
      "requires_runtime": [
        "hooks"
      ],
      "requires_tools": [
        "Bash"
      ],
      "path": "plugins/lucky/skills/bitacora/SKILL.md",
      "url": "${SKILLS_REGISTRY_URL}/v2.10.2/plugins/lucky/skills/bitacora/SKILL.md",
      "sha256": "4f8886da0f8dd695dc516a17c538c7fdff87c4884c9737c21fecb07d1b6be406"
    },
    {
      "name": "brujula",
      "kind": "runtime",
      "loadable_as_data": false,
      "requires_runtime": [],
      "requires_tools": [
        "Bash"
      ],
      "path": "plugins/lucky/skills/brujula/SKILL.md",
      "url": "${SKILLS_REGISTRY_URL}/v2.10.2/plugins/lucky/skills/brujula/SKILL.md",
      "sha256": "ee9ad82b85fe7f106a20a013ff330b07183397a13db613ea8ce03636cbda52d7"
    },
    {
      "name": "cargar",
      "kind": "runtime",
      "loadable_as_data": false,
      "requires_runtime": [
        "hooks"
      ],
      "requires_tools": [],
      "path": "plugins/lucky/skills/cargar/SKILL.md",
      "url": "${SKILLS_REGISTRY_URL}/v2.10.2/plugins/lucky/skills/cargar/SKILL.md",
      "sha256": "5acdfcdc538daaf5efe8eeebdf4944907781595e7b906f53eb7d374edcef879b"
    },
    {
      "name": "cargar/detectar-runtime.ref",
      "kind": "method",
      "loadable_as_data": true,
      "requires_runtime": [],
      "requires_tools": [],
      "path": "plugins/lucky/skills/cargar/references/detectar-runtime.md",
      "url": "${SKILLS_REGISTRY_URL}/v2.10.2/plugins/lucky/skills/cargar/references/detectar-runtime.md",
      "sha256": "2bbda91e060ba7e835dd6c1c6ab5198fa459ac1461f648975ce30e6f2a27df5b"
    },
    {
      "name": "crisol",
      "kind": "runtime",
      "loadable_as_data": false,
      "requires_runtime": [
        "disable-invocation",
        "allowed-tools-extra",
        "hooks"
      ],
      "requires_tools": [
        "Bash"
      ],
      "path": "plugins/lucky/skills/crisol/SKILL.md",
      "url": "${SKILLS_REGISTRY_URL}/v2.10.2/plugins/lucky/skills/crisol/SKILL.md",
      "sha256": "d511d55b94df8c55f603c59e100cbf2c48735c44db5ce90ac72918607bc6d8fa"
    },
    {
      "name": "cumplimiento",
      "kind": "runtime",
      "loadable_as_data": false,
      "requires_runtime": [
        "disable-invocation",
        "allowed-tools-extra"
      ],
      "requires_tools": [
        "Bash"
      ],
      "path": "plugins/lucky/skills/cumplimiento/SKILL.md",
      "url": "${SKILLS_REGISTRY_URL}/v2.10.2/plugins/lucky/skills/cumplimiento/SKILL.md",
      "sha256": "2aaefce581435b248088c96a56fd6ee6faad42d94acd3e49b51c333a58711f89"
    },
    {
      "name": "diagnostico",
      "kind": "runtime",
      "loadable_as_data": false,
      "requires_runtime": [],
      "requires_tools": [
        "Bash"
      ],
      "path": "plugins/lucky/skills/diagnostico/SKILL.md",
      "url": "${SKILLS_REGISTRY_URL}/v2.10.2/plugins/lucky/skills/diagnostico/SKILL.md",
      "sha256": "2c15bb56d52f650fc9a6272d425bd4e2904d6b5b48dc5c0e6fc5b3ae70cdc5b5"
    },
    {
      "name": "diseno",
      "kind": "runtime",
      "loadable_as_data": false,
      "requires_runtime": [
        "allowed-tools-extra"
      ],
      "requires_tools": [
        "Bash"
      ],
      "path": "plugins/lucky/skills/diseno/SKILL.md",
      "url": "${SKILLS_REGISTRY_URL}/v2.10.2/plugins/lucky/skills/diseno/SKILL.md",
      "sha256": "db723cd5e1de2a86304f2e7d938435565607867576bb55b1807e8e1f35dc2c99"
    },
    {
      "name": "feature",
      "kind": "runtime",
      "loadable_as_data": false,
      "requires_runtime": [
        "allowed-tools-extra"
      ],
      "requires_tools": [
        "Bash"
      ],
      "path": "plugins/lucky/skills/feature/SKILL.md",
      "url": "${SKILLS_REGISTRY_URL}/v2.10.2/plugins/lucky/skills/feature/SKILL.md",
      "sha256": "2bc33449d6cef2a9bdd4fd3ccdac3e2103b761fbd2f674fb448a623c27f2ba54"
    },
    {
      "name": "hotfix",
      "kind": "runtime",
      "loadable_as_data": false,
      "requires_runtime": [
        "allowed-tools-extra"
      ],
      "requires_tools": [
        "Bash"
      ],
      "path": "plugins/lucky/skills/hotfix/SKILL.md",
      "url": "${SKILLS_REGISTRY_URL}/v2.10.2/plugins/lucky/skills/hotfix/SKILL.md",
      "sha256": "1004b5ef2ebcbfe0f722c5cc748a6078337e0f78fc9d15ba5f265c4490bba7b3"
    },
    {
      "name": "idea",
      "kind": "runtime",
      "loadable_as_data": false,
      "requires_runtime": [
        "allowed-tools-extra"
      ],
      "requires_tools": [
        "Bash"
      ],
      "path": "plugins/lucky/skills/idea/SKILL.md",
      "url": "${SKILLS_REGISTRY_URL}/v2.10.2/plugins/lucky/skills/idea/SKILL.md",
      "sha256": "28e686d2b25cd3913393e7d8dab1b92f7834f2092748ac66f5b7429bfbf31a0e"
    },
    {
      "name": "ley",
      "kind": "runtime",
      "loadable_as_data": false,
      "requires_runtime": [
        "disable-invocation",
        "hooks"
      ],
      "requires_tools": [
        "Bash"
      ],
      "path": "plugins/lucky/skills/ley/SKILL.md",
      "url": "${SKILLS_REGISTRY_URL}/v2.10.2/plugins/lucky/skills/ley/SKILL.md",
      "sha256": "99ac82b17b845c8d21b907bcd956386e6cd8b966760ea316a17665da4d08506e"
    },
    {
      "name": "management",
      "kind": "runtime",
      "loadable_as_data": false,
      "requires_runtime": [],
      "requires_tools": [
        "Bash"
      ],
      "path": "plugins/lucky/skills/management/SKILL.md",
      "url": "${SKILLS_REGISTRY_URL}/v2.10.2/plugins/lucky/skills/management/SKILL.md",
      "sha256": "cef7fe1b1bf579c09b9a4c76880d2d23d377aad49d7e00a7e809ed56d3340fc5"
    },
    {
      "name": "microfix",
      "kind": "runtime",
      "loadable_as_data": false,
      "requires_runtime": [
        "allowed-tools-extra"
      ],
      "requires_tools": [
        "Bash"
      ],
      "path": "plugins/lucky/skills/microfix/SKILL.md",
      "url": "${SKILLS_REGISTRY_URL}/v2.10.2/plugins/lucky/skills/microfix/SKILL.md",
      "sha256": "565a57ac15724bf9ef48cf07e8a0138ef8756d4d3458a36ec5e167f491c29707"
    },
    {
      "name": "migrar",
      "kind": "runtime",
      "loadable_as_data": false,
      "requires_runtime": [
        "allowed-tools-extra"
      ],
      "requires_tools": [
        "Bash"
      ],
      "path": "plugins/lucky/skills/migrar/SKILL.md",
      "url": "${SKILLS_REGISTRY_URL}/v2.10.2/plugins/lucky/skills/migrar/SKILL.md",
      "sha256": "7d3d538220981828c24e78bdabd6c297202cd42e63c56d9f974a77652bf3923d"
    },
    {
      "name": "saber",
      "kind": "runtime",
      "loadable_as_data": false,
      "requires_runtime": [
        "allowed-tools-extra"
      ],
      "requires_tools": [
        "Bash"
      ],
      "path": "plugins/lucky/skills/saber/SKILL.md",
      "url": "${SKILLS_REGISTRY_URL}/v2.10.2/plugins/lucky/skills/saber/SKILL.md",
      "sha256": "ad3367559daf669c6f792abec90edbd09c12d366864fcccd1522664e0ab6de27"
    }
  ]
}
